<?xml version="1.0" encoding="UTF-8"?><?xml-stylesheet href="file://localhost/T:/XML/NTRF.css" type="text/css"?><!DOCTYPE VOCABULARY SYSTEM
        "file://localhost/x:/NTRF.dtd">
<VOCABULARY>
    <RECORD numb="c100" stat="VALID" upda="some_user,2022-03-30">
        <SUBJ>Käyttöala</SUBJ>

        <LANG value="fi">
            <TE stat="VALID">
                <EQUI value="broader">test</EQUI>
                <TERM>testitermi <GRAM gend="f" value="pl" pos="wordClass" /></TERM>
                <HOGR>1</HOGR>
                <SCOPE>käyttöala</SCOPE>
                <!-- source of recommended term = sources of the concept -->
                <SOURF>Lähde</SOURF>
                <ADD>Termin lisätieto</ADD>
                <REMK>ylläpitäjän muistiinpano</REMK>
            </TE>
            <SY>
                <EQUI value="broader"></EQUI>
                <TERM>testisynonyymi</TERM>
                <SOURF>Lähde 2</SOURF>
            </SY>

            <DEF>Käsitteen määritelmä</DEF>
            <NOTE>Huomautus 1</NOTE>
            <NOTE>Huomautus 2</NOTE>
            <STE>
                <TERM>hakutermi</TERM>
            </STE>
        </LANG>
        <REMK>Editorial note concept</REMK>
        <CLAS>Käsitteen luokka</CLAS>
    </RECORD>
</VOCABULARY>